,titre,jour_publication,auteur
0,Amtrak menacé par les eaux,Publié le 31 déc. 2018 à 1:01,Jacques Hubert-Rodier
1,Scrutin historique en République démocratique du Congo,Publié le 31 déc. 2018 à 1:01,Yves Bourdillon
2,Le CAC 40 termine sur une note positive,Publié le 31 déc. 2018 à 1:01,Isabelle Couet
3,Quelles compétences développer dans une économie moderne ?,Publié le 31 déc. 2018 à 1:01,
4,Les événements de l'année 2018,Mis à jour le 6 août 2019 à 0:00,Eleonore de Bailliencourt
5,"L'euro, notre bien le plus précieux",Mis à jour le 6 août 2019 à 0:00,Daniel Fortin
6,Sortir de la crise ? Quelques propositions simples,Mis à jour le 6 août 2019 à 0:00,Pierre Mehaignerie
7,Pour une justice partagée,Mis à jour le 6 août 2019 à 0:00,Jerome Giusti
8,Dépasser notre vision colbertiste du sport,Mis à jour le 6 août 2019 à 0:00,Alain Loret
9,« Casse-Noisette » de fête au Théâtre des Champs-Elysées,Mis à jour le 6 août 2019 à 0:00,Philippe Noisette
10,La Fondation HCB emménage avec Martine Franck,Mis à jour le 6 août 2019 à 0:00,
11,Un banquier français à la tête du géant russe de l'aluminium,Mis à jour le 6 août 2019 à 0:00,Isabelle Couet
12,Mario Draghi,Mis à jour le 6 août 2019 à 0:00,Guillaume Maujean
13,Visite surprise de Donald Trump en Irak,Publié le 28 déc. 2018 à 1:01,Virginie Robert
14,Takeda fait sa révolution,Publié le 28 déc. 2018 à 1:01,Catherine Ducruet
15,Sanofi s'affirme comme le numéro un des donations,Publié le 28 déc. 2018 à 1:01,Catherine Ducruet
16,La plus grande barge de France va être réparée à Dunkerque,Publié le 28 déc. 2018 à 1:01,Nicole Buyse
17,La Bourse de Paris clôture une nouvelle fois en baisse,Publié le 28 déc. 2018 à 1:01,Laurence Boisseau
18,Le moteur cassé du commerce mondial,Mis à jour le 6 août 2019 à 0:00,Jean-Marc Vittori
19,Accès des PME à la commande publique : il reste beaucoup à faire,Mis à jour le 6 août 2019 à 0:00,Jean-Marc Peyrical
20,L'inquiétude des investisseurs sur les marchés est exagérée,Mis à jour le 6 août 2019 à 0:00,Laurence Daziano
21,Evitons une levée des « gilets jaunes » du commerce,Mis à jour le 6 août 2019 à 0:00,Andre Tordjman
22,"Le saumon, icône de mondialisation",Mis à jour le 6 août 2019 à 0:00,François Lévêque
23,Michel Houellebecq,Mis à jour le 6 août 2019 à 0:00,Pierre de Gasquet
24,"Un séisme frappe l'Etna, en éruption",Publié le 27 déc. 2018 à 1:01,Virginie Robert
25,Shell veut doubler ses investissements dans les énergies vertes,Publié le 27 déc. 2018 à 1:01,Raphaël Bloch
26,Quelques règles d'or pour la croissance,Publié le 27 déc. 2018 à 1:01,
27,"Le bitcoin est mort, vive le bitcoin",Mis à jour le 6 août 2019 à 0:00,Guillaume Maujean
28,Trump ou la rage d'un pouvoir déclinant,Mis à jour le 6 août 2019 à 0:00,
29,"Le stockage d'énergie, enjeu majeur de la transition énergétique",Mis à jour le 6 août 2019 à 0:00,
30,"L'assurance-construction, talon d'Achille de l'immobilier",Mis à jour le 6 août 2019 à 0:00,Alexandra Francois-Cuxac
31,« Sérotonine » : le voyage au bout de l'ennui de Houellebecq,Mis à jour le 6 août 2019 à 0:00,Pierre de Gasquet
32,« Azor » : opérette version sixties survoltées à l'Athénée,Mis à jour le 6 août 2019 à 0:00,Philippe Venturini
33,Cécile Duflot,Mis à jour le 6 août 2019 à 0:00,Arnaud Le Gal
34,Un message consacré « à la fraternité » entre les peuples,Publié le 26 déc. 2018 à 1:01,Virginie Robert
35,La Bourse de Paris déprimée avant les fêtes de Noël,Publié le 26 déc. 2018 à 1:01,Laurence Boisseau
36,Frankenstein à Wall Street,Mis à jour le 6 août 2019 à 0:00,Guillaume Maujean
37,Quelle gouvernance pour le monde qui vient ?,Mis à jour le 6 août 2019 à 0:00,Pascal Picq
38,Restaurer l'unité nationale est une priorité,Mis à jour le 6 août 2019 à 0:00,Roland Gilles
39,Miser sur les entreprises françaises pour numériser l'Etat,Mis à jour le 6 août 2019 à 0:00,Nathalie Dupuis-Hepner
40,"Louis Garrel, « L'Homme fidèle » à lui-même",Mis à jour le 6 août 2019 à 0:00,Olivier De Bruyn
41,« Monsieur » : rapport de classes,Mis à jour le 6 août 2019 à 0:00,Olivier De Bruyn
42,"Tim Sweeney, le patron qui ose se mesurer aux Gafa",Mis à jour le 6 août 2019 à 0:00,Florian Dèbes
43,Stéphane Boujnah,Mis à jour le 6 août 2019 à 0:00,Arnaud Le Gal
44,L'indexation des prestations sociales rétablie pour 2020,Publié le 24 déc. 2018 à 1:01,Stéphane Dupont
45,60 % des Français font confiance au système bancaire,Publié le 24 déc. 2018 à 1:01,Marie-Christine Sonkin
46,La Bourse de Paris chute de plus de 3 % sur la semaine,Publié le 24 déc. 2018 à 1:01,Laurence Boisseau
47,Pénible stock,Publié le 24 déc. 2018 à 1:01,
48,Comment parler philosophie et management ?,Publié le 24 déc. 2018 à 1:01,
49,L'épargne française en garde à vue,Mis à jour le 6 août 2019 à 0:00,Jean-Marc Vittori
50,Droit d'asile : en finir avec Dublin,Mis à jour le 6 août 2019 à 0:00,Thierry Pech
51,Renoncer au mythe du président providentiel,Mis à jour le 6 août 2019 à 0:00,Michel Aubouin
52,Les ports français face au défi du Brexit,Mis à jour le 6 août 2019 à 0:00,Franck Brault
53,Campana : le Pantagruel de la collection revit au Louvre,Mis à jour le 6 août 2019 à 0:00,
54,"Alexis Gruss, la piste en famille",Mis à jour le 6 août 2019 à 0:00,Philippe Noisette
55,James Mattis,Mis à jour le 6 août 2019 à 0:00,Henri Gibier
56,Le « Spiegel » dans la tourmente,Publié le 21 déc. 2018 à 1:01,Pauline Houédé
57,Londres : des drones sèment la pagaille à l'aéroport de Gatwick,Publié le 21 déc. 2018 à 1:01,Bruno Trévidic
58,Airbus trébuche en Bourse après des informations sur une enquête américaine,Publié le 21 déc. 2018 à 1:01,Anne Bauer
59,Dernière ligne droite pour le service de messagerie de Qwant,Publié le 21 déc. 2018 à 1:01,Guillaume Bregeras
60,"Tonsser, le réseau social du foot, passe en mode pro",Publié le 21 déc. 2018 à 1:01,Guillaume Bregeras
61,Blackink veut faciliter l'accès à l'information,Publié le 21 déc. 2018 à 1:01,Déborah Loye
62,Cession à La Banque Postale,Publié le 21 déc. 2018 à 1:01,
63,La Bourse de Paris au plus bas depuis deux ans,Publié le 21 déc. 2018 à 1:01,Pierrick Fay
64,Défiscalisation : faut-il investir dans les FCPI et les FIP en 2018 ?,Publié le 21 déc. 2018 à 1:01,Anne-Sophie Vion
65,L'OUEST très dynamique,Publié le 21 déc. 2018 à 1:01,Anne-Sophie Vion
66,Objets d'art : revente mode d'emploi,Publié le 21 déc. 2018 à 1:01,Hélène Dupuy
67,Quelle fiscalité ?,Publié le 21 déc. 2018 à 1:01,Hélène Dupuy
68,"Andy Warhol : mode, polémiques et millions de dollars",Publié le 21 déc. 2018 à 1:01,Judith Benhamou
69,Malt : Axéréal s'offre les activités de Cargill,Publié le 21 déc. 2018 à 1:01,Marie-Josée Cougard
70,L'air du temps,Mis à jour le 6 août 2019 à 0:00,Henri Gibier
71,L'agenda en France,Publié le 21 déc. 2018 à 1:01,Ludovic Bischoff
72,Salle d'attente,Publié le 21 déc. 2018 à 1:01,Philippe Besson
73,L'agenda à Paris,Publié le 21 déc. 2018 à 1:01,Alice d'Orgeval
74,L'agenda ailleurs,Publié le 21 déc. 2018 à 1:01,Alice d'Orgeval
75,La playlist de l'actu,Publié le 21 déc. 2018 à 1:01,
76,Jeanne Added,Mis à jour le 6 août 2019 à 0:00,Isabelle Lesniak
77,5 dates dans l'histoire du sapin de Noël,Publié le 21 déc. 2018 à 1:01,Isabelle Lesniak
78,"Robert Habeck, le nouveau héros des Verts allemands",Mis à jour le 6 août 2019 à 0:00,Ninon Renaud
79,"La Pléiade, en attendant Gary",Publié le 21 déc. 2018 à 1:01,Pierre de Gasquet
80,Beaux livres en fêtes,Publié le 21 déc. 2018 à 1:01,
81,Hollywood à Marrakech,Mis à jour le 6 août 2019 à 0:00,Cecilia Delporte
82,Noël de Legend,Mis à jour le 6 août 2019 à 0:00,Philippe Chevilley
83,"Anne Perry, la mère polar de Noël",Mis à jour le 6 août 2019 à 0:00,Laurance N'Kaoua
84,"René Tardi, dernier acte",Mis à jour le 6 août 2019 à 0:00,David Barroux
85,Salles obscures,Publié le 21 déc. 2018 à 1:01,Thierry Gandillot
86,Et la mode devint morale,Publié le 21 déc. 2018 à 1:01,Loïc Prigent
87,L'année de toutes les diversités,Publié le 21 déc. 2018 à 1:01,Loïc Prigent
88,Le grand mercato,Publié le 21 déc. 2018 à 1:01,Loïc Prigent
89,Des collabs comme s'il en pleuvait,Publié le 21 déc. 2018 à 1:01,Loïc Prigent
90,"Hedi, Virgil et Kim: les capteurs du temps",Publié le 21 déc. 2018 à 1:01,Loïc Prigent
91,Toujours plus show,Publié le 21 déc. 2018 à 1:01,Loïc Prigent
92,12 «fashion moments» qui ont fait bouger les lignes,Publié le 21 déc. 2018 à 1:01,
93,Et vive la France!,Publié le 21 déc. 2018 à 1:01,Loïc Prigent
94,Le make-up est-il l'avenir de l'homme?,Publié le 21 déc. 2018 à 1:01,Johanne Courbatère de Gaudric
95,La théorie de l'évolution,Publié le 21 déc. 2018 à 1:01,Johanne Courbatère de Gaudric
96,Tenue de soirée,Publié le 21 déc. 2018 à 1:01,Frank DECLERCK
97,Écoutez le silenzzzzzzzzzz,Publié le 21 déc. 2018 à 1:01,Raphaël Sachetat
98,"Le Beslay, affaire à suivre",Mis à jour le 6 août 2019 à 0:00,Laurent Guez
99,La rédaction des «Échos» a testé,Mis à jour le 6 août 2019 à 0:00,
100,L'ascension de Lastours,Publié le 21 déc. 2018 à 1:01,Jean-Francis Pécresse
101,Le grain de sel de Yasushi Hayashi,Publié le 21 déc. 2018 à 1:01,Jerome Berger
102,"Le repaire Le «Royal Champagne», à Épernay, au coeur des vignes",Publié le 21 déc. 2018 à 1:01,Mireille Gignoux
103,Small is beautiful,Publié le 21 déc. 2018 à 1:01,Cédric Fréour
104,Les habits neufs du repas de Noël,Publié le 21 déc. 2018 à 1:01,Jessica Berthereau
105,Délices d'initiés,Publié le 21 déc. 2018 à 1:01,Jean-Denis Errard
106,Conspirations,Publié le 21 déc. 2018 à 1:01,Marc Dugain
107,La prime sans la réforme,Mis à jour le 6 août 2019 à 0:00,Étienne Lefebvre
108,Nouvelle donne en Syrie,Mis à jour le 6 août 2019 à 0:00,Jacques Hubert-Rodier
109,Ce mal qui touche les anciennes stars high-tech de Noël,Mis à jour le 6 août 2019 à 0:00,Nicolas Richaud
110,Un déficit en trompe-l'oeil,Mis à jour le 6 août 2019 à 0:00,
111,Joyeux Noël légionnaire !,Mis à jour le 6 août 2019 à 0:00,Julien Damon
112,Le retour aux sources du macronisme,Mis à jour le 6 août 2019 à 0:00,Jacky Bontems
113,"L'ouverture en soirée, une priorité pour le commerce",Mis à jour le 6 août 2019 à 0:00,Christian Pimont
114,Aux sources du populisme,Mis à jour le 6 août 2019 à 0:00,Daniel Fortin
115,"Harari, saison 3",Mis à jour le 6 août 2019 à 0:00,Daniel Fortin
116,Retour sur quarante ans d'islamisme,Mis à jour le 6 août 2019 à 0:00,Daniel Fortin
117,Le testament de Stephen Hawking,Mis à jour le 6 août 2019 à 0:00,Daniel Fortin
118,"Algorithmes, attention danger !",Mis à jour le 6 août 2019 à 0:00,Daniel Fortin
119,Quand le travail devient absurde,Mis à jour le 6 août 2019 à 0:00,Daniel Fortin
120,Quelle société face au numérique ?,Mis à jour le 6 août 2019 à 0:00,Daniel Fortin
121,Les dérives de la mondialisation,Mis à jour le 6 août 2019 à 0:00,Daniel Fortin
122,Dix vérités économiques,Mis à jour le 6 août 2019 à 0:00,Daniel Fortin
123,La rançon de la transition énergétique,Mis à jour le 6 août 2019 à 0:00,Daniel Fortin
124,Tikaway téléporte les experts sur le terrain avec ses lunettes connectées,Mis à jour le 6 août 2019 à 0:00,Lea Delpont
125,I-Wantit lève 1 million pour son application des cadeaux utiles,Mis à jour le 6 août 2019 à 0:00,Paul Molga
126,Les marchés s'enfoncent un peu plus dans le rouge,Mis à jour le 6 août 2019 à 0:00,Pierrick Fay
127,"Marc Van Peteghem, architecte écolo",Mis à jour le 6 août 2019 à 0:00,Stanislas du Guerny
128,Chantal Jouanno,Mis à jour le 6 août 2019 à 0:00,Sabine Delanglade
129,Le leader mondial de l'aspirine change de nom et devient Seqens,Publié le 20 déc. 2018 à 1:01,Enrique Moreira
130,Takis Candilis : « France.tv sera notre principal canal de diffusion »,Publié le 20 déc. 2018 à 1:01,Marina Alcaraz
131,Dataiku pourrait être la prochaine licorne française,Publié le 20 déc. 2018 à 1:01,Déborah Loye
132,Salesforce s'invite au capital d'Akeneo,Publié le 20 déc. 2018 à 1:01,Emmanuel Guimard
133,La Bourse de Paris rebondit timidement avant la Fed,Publié le 20 déc. 2018 à 1:01,Laurence Boisseau
134,GE pourrait faire coter sa division santé,Publié le 20 déc. 2018 à 1:01,Laurence Boisseau
135,Andreessen vs. Zuckerberg : inflation de titres ou choix de la mesure ?,Publié le 20 déc. 2018 à 1:01,
136,Punir Facebook ?,Mis à jour le 6 août 2019 à 0:00,David Barroux
137,Gueule de bois budgétaire,Mis à jour le 6 août 2019 à 0:00,Étienne Lefebvre
138,Comment les grandes puissances se disputent l'Afrique,Mis à jour le 6 août 2019 à 0:00,Jacques Hubert-Rodier
139,Transformer le Cese en « conseil citoyen »,Mis à jour le 6 août 2019 à 0:00,
140,Vingt ans d'histoire de l'art en France,Mis à jour le 6 août 2019 à 0:00,Martine Robert
141,Les limites du référendum d'initiative citoyenne,Mis à jour le 6 août 2019 à 0:00,Gilles Toulemonde
142,La jaunisse du modèle social français,Mis à jour le 6 août 2019 à 0:00,Jacques Delpla
143,Un « Hamlet » de rêve à l'Opéra-Comique,Mis à jour le 6 août 2019 à 0:00,Philippe Venturini
144,« Trois étages » : du côté de chez Freud,Mis à jour le 6 août 2019 à 0:00,Frédérique Humblot
145,"Renault, quatre semaines en enfer",Mis à jour le 6 août 2019 à 0:00,Anne Feitz
146,Oxana Monge veille à la santé de Sanofi à Moscou,Mis à jour le 6 août 2019 à 0:00,Benjamin Quenelle
147,Sheryl Sandberg,Mis à jour le 6 août 2019 à 0:00,Sabine Delanglade
148,Espionnage : Huawei allume les contre-feux,Publié le 19 déc. 2018 à 1:01,Raphaël Balenieri
149,Investissements dans la recherche : l'écart se creuse entre l'Europe et les Etats-Unis,Publié le 19 déc. 2018 à 1:01,Catherine Chatignoux
150,"L'apogée est passé, jugent les exportateurs allemands",Publié le 19 déc. 2018 à 1:01,Ninon Renaud
151,"Cesare Battisti, « terroriste fétiche »",Publié le 19 déc. 2018 à 1:01,Thierry Ogier
152,"Incendie dans Manaus, la capitale de l'Amazonie",Publié le 19 déc. 2018 à 1:01,Yves Bourdillon
153,"SunPower, la filiale de Total, contrainte de changer de stratégie",Publié le 19 déc. 2018 à 1:01,Vincent Collen
154,Charles Beigbeder investit dans les technologies quantiques,Publié le 19 déc. 2018 à 1:01,Anne Drif
155,"PixelMe, la plate-forme marketing pour les PME",Publié le 19 déc. 2018 à 1:01,Guillaume Bregeras
156,La menace d'une récession se fait plus pressante,Publié le 19 déc. 2018 à 1:01,Pierrick Fay
157,Des risques politiques et géopolitiques toujours présents,Publié le 19 déc. 2018 à 1:01,Pierrick Fay
158,Des bénéfices moins bien orientés,Publié le 19 déc. 2018 à 1:01,Pierrick Fay
159,Bien gérer la sortie des banques centrales,Publié le 19 déc. 2018 à 1:01,Pierrick Fay
160,La Bourse de Paris décline vers les 4.700 points,Publié le 19 déc. 2018 à 1:01,Muryel Jacque
161,La seconde vie des gravats de l'ex-école Centrale,Publié le 19 déc. 2018 à 1:01,Marion Kindermans
162,PARIS La Villette se met à la réalité virtuelle,Publié le 19 déc. 2018 à 1:01,Lamia Barbot
163,La SNCF poursuit la reconversion de ses halles ferroviaires,Publié le 19 déc. 2018 à 1:01,Laurence Albert
164,Le Val-de-Marne encourage les actions en faveur du climat,Publié le 19 déc. 2018 à 1:01,Lamia Barbot
165,Vallée de Chevreuse : la monnaie La Racine entre en circulation,Publié le 19 déc. 2018 à 1:01,
166,L'eau adoucie arrive dans le sud de l'Essonne,Publié le 19 déc. 2018 à 1:01,Lamia Barbot
167,L'industrie de Cergy-Pontoise reçoit le soutien de l'Etat,Publié le 19 déc. 2018 à 1:01,Florence Renard-Gourdon
168,Lyon terre de prédilection des navettes autonomes,Publié le 19 déc. 2018 à 1:01,Vincent Charbonnier
169,LYON La Métropole lance son cadastre solaire,Publié le 19 déc. 2018 à 1:01,Lea Delpont
170,"EasyJet, première compagnie aérienne à Lyon",Publié le 19 déc. 2018 à 1:01,Lamia Barbot
171,Xi Jinping réaffirme le rôle central du Parti communiste,Mis à jour le 6 août 2019 à 0:00,Frédéric Schaeffer
172,Comment le pays a opéré sa mue,Mis à jour le 6 août 2019 à 0:00,Michel De Grandi
173,"Aux Etats-Unis, le pétrole de schiste à l'heure des doutes",Mis à jour le 6 août 2019 à 0:00,Elsa Conesa
174,Une vraie rupture pour les marchés,Mis à jour le 6 août 2019 à 0:00,Guillaume Maujean
175,Pouvoir de non-achat,Mis à jour le 6 août 2019 à 0:00,Jean-Marc Vittori
176,L'intelligence artificielle est-elle intelligente ?,Mis à jour le 6 août 2019 à 0:00,
177,Le scrapbook du duo de Nature & Découvertes,Mis à jour le 6 août 2019 à 0:00,Valérie Leboucq
178,Pour une politique industrielle européenne ambitieuse,Mis à jour le 6 août 2019 à 0:00,Dieter Kempf
179,Pourquoi la révolte sociale peut durer,Mis à jour le 6 août 2019 à 0:00,Hippolyte d'Albis
180,L'hiver de Vidocq,Mis à jour le 6 août 2019 à 0:00,Adrien Gombeaud
181,Gratuit et incontrôlable,Mis à jour le 6 août 2019 à 0:00,Thierry Gandillot
182,Le Retour de Mary Poppins,Mis à jour le 6 août 2019 à 0:00,Thierry Gandillot
183,Cartesiam lève 2 millions pour le « Shazam des équipements industriels »,Mis à jour le 6 août 2019 à 0:00,Paul Molga
184,Medylink acquiert Medway pour intégrer la téléconsultation,Mis à jour le 6 août 2019 à 0:00,Laurent Marcaillou
185,Des marchés entre prudence et quête de protection pour 2019,Mis à jour le 6 août 2019 à 0:00,Pierrick Fay
186,"France Burgy, pour former les fonctionnaires",Mis à jour le 6 août 2019 à 0:00,Claire Garnier
187,José Mourinho,Mis à jour le 6 août 2019 à 0:00,Sabine Delanglade
188,Les retraités vont devoir attendre six mois pour bénéficier de la baisse de la CSG,Publié le 18 déc. 2018 à 1:01,Solveig Godeluck
189,La plus grande patinoire de France revient au Grand Palais,Publié le 18 déc. 2018 à 1:01,Martine Robert
190,"A Paris, l'immobilier de luxe marque des points",Publié le 18 déc. 2018 à 1:01,Anne-Sophie Vion
191,Une prime exceptionnelle pour quelque 100.000 cheminots,Publié le 18 déc. 2018 à 1:01,Lionel Steinmann
192,Ogury rachète Influans pour doper son offre de marketing transversale,Publié le 18 déc. 2018 à 1:01,Guillaume Bregeras
193,"Redison, la pépite pour musiciens du Louvre-Lens Vallée",Publié le 18 déc. 2018 à 1:01,Nicole Buyse
194,Protomotech protège les oeuvres grâce à ses capteurs intelligents,Publié le 18 déc. 2018 à 1:01,Nicole Buyse
195,La Bourse de Paris s'enfonce sous les 4.800 points,Publié le 18 déc. 2018 à 1:01,Muryel Jacque
196,Fin d'année animée sur le marché du Sukuk,Publié le 18 déc. 2018 à 1:01,Guillaume Benoit
197,"« TANT QU'IL Y A DE LA TRESORERIE, IL FAUT S'ACCROCHER »",Publié le 18 déc. 2018 à 1:01,Laetitia Lienhard
198,Salariés aidants : les actions des entreprises pour soulager,Publié le 18 déc. 2018 à 1:01,
199,"La prime d'activité, ou l'impôt négatif",Mis à jour le 6 août 2019 à 0:00,Étienne Lefebvre
200,Démocratiser la démocratie,Mis à jour le 6 août 2019 à 0:00,Jean-Francis Pécresse
201,Theresa May ou la stratégie de la boîte de conserve,Mis à jour le 6 août 2019 à 0:00,Alexandre Counis
202,La retraite en travaillant,Mis à jour le 6 août 2019 à 0:00,
203,L'entreprise réinventée par Elon Musk,Mis à jour le 6 août 2019 à 0:00,Anne Feitz
204,Pourquoi il faut libérer Carlos Ghosn,Mis à jour le 6 août 2019 à 0:00,Philippe Ries
205,"L'économie sociale et solidaire, un formidable levier d'action",Mis à jour le 6 août 2019 à 0:00,Christophe Itier
206,Soleil d'hiver à Vancouver,Mis à jour le 6 août 2019 à 0:00,Philippe Chevilley
207,Fantastique « Rodelinda » à l'Opéra de Lyon,Mis à jour le 6 août 2019 à 0:00,Philippe Venturini
208,Les codeurs programment-ils leur fin ?,Mis à jour le 6 août 2019 à 0:00,Remy Demichelis
209,Champagne : vers la fin des bouteilles premier prix ?,Mis à jour le 6 août 2019 à 0:00,Guillaume Roussange
210,"Mariya Gabriel, femme d'influence",Mis à jour le 6 août 2019 à 0:00,Derek Perrotte
211,Xi Jinping,Mis à jour le 6 août 2019 à 0:00,Sabine Delanglade
212,L'anglais de rigueur dans un tribunal néerlandais,Publié le 17 déc. 2018 à 1:01,Didier Burg
213,"Les poulets d'élevage, symbole de l'anthropocène ?",Publié le 17 déc. 2018 à 1:01,Yann Verdo
214,Les Bleues du handball championnes d'Europe,Publié le 17 déc. 2018 à 1:01,Florian Dèbes
215,"L'hôtellerie de luxe, un secteur en croissance et en consolidation",Publié le 17 déc. 2018 à 1:01,Christophe Palierse
216,Brittany Ferries met à l'eau son premier ferry propulsé au GNL,Publié le 17 déc. 2018 à 1:01,Stanislas du Guerny
217,Intelligence artificielle : quand les Français draguent les Américains,Publié le 17 déc. 2018 à 1:01,Nicolas Rauline
218,"Pays-Bas, le pays où les fonds ignorent les startuppeuses",Publié le 17 déc. 2018 à 1:01,Didier Burg
219,"TokenData, le français qui se rêve en « Bloomberg de la crypto »",Publié le 17 déc. 2018 à 1:01,Raphaël Bloch
220,Fin de semaine difficile pour la Bourse de Paris,Publié le 17 déc. 2018 à 1:01,Guillaume Benoit
221,Business positif : place aux actes !,Publié le 17 déc. 2018 à 1:01,
222,Les 5 idées à retenir du... « Management juste »,Publié le 17 déc. 2018 à 1:01,
223,Le rôle pivot de l'entreprise,Publié le 17 déc. 2018 à 1:01,Muriel Jasor
224,Auto-partage : la RSE dans l'ADN de Citiz,Publié le 17 déc. 2018 à 1:01,
225,"Emeric Lepoutre : « Outil de transformation, la RSE bénéficie à tous »",Publié le 17 déc. 2018 à 1:01,Muriel Jasor
226,Raison d'être,Publié le 17 déc. 2018 à 1:01,Eric Albert
227,S'acclimater au changement,Mis à jour le 6 août 2019 à 0:00,Jean-Francis Pécresse
228,Simple et pas cher,Mis à jour le 6 août 2019 à 0:00,David Barroux
229,L'indépendance contestée des banques centrales,Mis à jour le 6 août 2019 à 0:00,Guillaume Benoit
230,Trois pistes pour sauver l'enseignement supérieur,Mis à jour le 6 août 2019 à 0:00,
231,Comment le Moyen Age a façonné le monde,Mis à jour le 6 août 2019 à 0:00,Nessim Aït-Kacimi
232,Sortir le mécénat d'entreprise de l'inconstance fiscale,Mis à jour le 6 août 2019 à 0:00,Stephane Couchoux
233,La trajectoire carbone : une taxation nécessaire et vertueuse,Mis à jour le 6 août 2019 à 0:00,Pascal Roger
234,Festival Impatience : une « Place » de choix,Mis à jour le 6 août 2019 à 0:00,Philippe Chevilley
235,Le CHU d'Amiens lance une étude inédite sur le cancer du foie,Mis à jour le 6 août 2019 à 0:00,Guillaume Roussange
236,Sterblue automatise le vol des drones d'inspection,Mis à jour le 6 août 2019 à 0:00,Emmanuel Guimard
237,"Dominique de la Garanderie, cinquante ans au service des avocats",Mis à jour le 6 août 2019 à 0:00,Delphine Iweins
238,James Hackett,Mis à jour le 6 août 2019 à 0:00,Henri Gibier
239,L'avortement divise la coalition allemande,Publié le 14 déc. 2018 à 1:01,Ninon Renaud
240,L'avion spatial de Virgin Galactic réussit son vol d'essai,Publié le 14 déc. 2018 à 1:01,Michel De Grandi
241,Le flamboyant baroud d'honneur de Nancy Pelosi,Publié le 14 déc. 2018 à 1:01,Nicolas Rauline
242,Deux sujets chauds : la distribution et la consolidation du secteur,Publié le 14 déc. 2018 à 1:01,Antoine Boudet
243,La rentrée littéraire sur le gril,Publié le 14 déc. 2018 à 1:01,Véronique Richebois
244,Les « gilets jaunes » fragilisent les ventes des libraires,Publié le 14 déc. 2018 à 1:01,Véronique Richebois
245,La start-up Dott se rêve en leader européen des mobilités partagées,Publié le 14 déc. 2018 à 1:01,Adrien Lelièvre
246,La French Tech repositionne son déploiement en France et dans le monde,Publié le 14 déc. 2018 à 1:01,Déborah Loye
247,"Kat Borlongan : « Quand une entreprise recrute, c'est aussi son pays qui recrute »",Publié le 14 déc. 2018 à 1:01,Déborah Loye
248,La Bourse de Paris déçue par les prévisions de la BCE,Publié le 14 déc. 2018 à 1:01,Laurence Boisseau
249,Natixis IM regroupe trois affiliés spécialisés en « private equity »,Publié le 14 déc. 2018 à 1:01,Sophie Rolland
250,Les pièges du prélèvement à la source,Publié le 14 déc. 2018 à 1:01,Marie-Christine Sonkin
251,Dynamique immobilière,Publié le 14 déc. 2018 à 1:01,Marie-Christine Sonkin
252,Les solutions pour donner sans payer d'impôts,Publié le 14 déc. 2018 à 1:01,
253,Dons aux enfants et petits-enfants : profitez des abattements et exonérations,Publié le 14 déc. 2018 à 1:01,Nathalie Cheysson-Kaplan
254,Enchères : moins de 3.000 euros pour des oeuvres séduisantes,Publié le 14 déc. 2018 à 1:01,Judith Benhamou
255,Succession à succès,Mis à jour le 6 août 2019 à 0:00,Henri Gibier
256,L'agenda en France,Publié le 14 déc. 2018 à 1:01,Ludovic Bischoff
257,L'agenda à Paris,Publié le 14 déc. 2018 à 1:01,Alice d'Orgeval
258,Salle d'attente,Publié le 14 déc. 2018 à 1:01,Philippe Besson
259,L'agenda ailleurs,Publié le 14 déc. 2018 à 1:01,Alice d'Orgeval
260,La playlist de l'actu,Publié le 14 déc. 2018 à 1:01,
261,Victor Lugger et Tigrane Seydoux,Mis à jour le 6 août 2019 à 0:00,Mariana Reali
262,Patrick Pouyanné patron XXL,Mis à jour le 6 août 2019 à 0:00,Pascal Pogam
263,7 opérations sauvetage des forêts,Publié le 14 déc. 2018 à 1:01,Stefano Lupieri
264,Profession restaurateur,Publié le 14 déc. 2018 à 1:01,Isabelle Lesniak
265,"Klaxoon, la réunion dans la joie",Publié le 14 déc. 2018 à 1:01,Isabelle Lesniak
266,Offenbach for ever,Mis à jour le 6 août 2019 à 0:00,Thierry Gandillot
267,Le boss au plus près,Mis à jour le 6 août 2019 à 0:00,FRANCOIS BOURBOULON
