,titre,jour_publication,auteur
543,Les artisans du Rhône apportent leur pierre à Confluence,Publié le 5 déc. 2018 à 1:01,Vincent Charbonnier
544,Les espaces de travail en pleine mutation,Publié le 5 déc. 2018 à 1:01,Catherine Sabbah
545,Le premier recul d'Emmanuel Macron,Mis à jour le 6 août 2019 à 0:00,Grégoire Poussielgue
546,Lâcher du lest pour sauver l'essentiel,Mis à jour le 6 août 2019 à 0:00,Dominique Seux
547,Le pari de Free,Mis à jour le 6 août 2019 à 0:00,David Barroux
548,Logement : à la recherche d'une politique efficace,Mis à jour le 6 août 2019 à 0:00,Catherine Sabbah
549,Menaces sur le cloud,Mis à jour le 6 août 2019 à 0:00,
550,L'hôpital vu depuis la coulisse,Mis à jour le 6 août 2019 à 0:00,Solveig Godeluck
551,Réconcilier l'énergie et le climat,Mis à jour le 6 août 2019 à 0:00,Laurence Daziano
552,Fausse bonne nouvelle à Buenos Aires,Mis à jour le 6 août 2019 à 0:00,Lionel Fontagne
553,« Leto » : Rock Back in the U.S.S.R.,Mis à jour le 6 août 2019 à 0:00,Thierry Gandillot
554,« Les Confins du monde » : la fin du Tonkin,Mis à jour le 6 août 2019 à 0:00,Adrien Gombeaud
555,Marche ou crève,Mis à jour le 6 août 2019 à 0:00,Olivier De Bruyn
556,Le jeu de poker menteur sur la consolidation dans les télécoms,Mis à jour le 6 août 2019 à 0:00,Fabienne Schmitt
557,Assystem introduit le bambou dans les composites des avions,Mis à jour le 6 août 2019 à 0:00,Laurent Marcaillou
558,"My Keeper crée Secur Ecole, la balise qui protège les élèves",Mis à jour le 6 août 2019 à 0:00,Paul Molga
559,"Le Crédit Mutuel dit adieu à Michel Lucas, son « grand architecte »",Mis à jour le 6 août 2019 à 0:00,Édouard Lederer
560,Candy Réjasse prend les clefs de La Limousine de Constructions,Mis à jour le 6 août 2019 à 0:00,
561,Xavier Niel,Mis à jour le 6 août 2019 à 0:00,Sabine Delanglade
562,Plus de cent lycées bloqués,Publié le 4 déc. 2018 à 1:01,Marie-Christine Corbier
563,La fusée Soyouz s'envole vers l'ISS,Publié le 4 déc. 2018 à 1:01,Yves Bourdillon
564,L'Europe en chemin vers une « European Tech »,Publié le 4 déc. 2018 à 1:01,Déborah Loye
565,Agricool attaque l'industrialisation de son déploiement,Publié le 4 déc. 2018 à 1:01,Guillaume Bregeras
566,Lancer sa start-up reste réservé à une élite,Publié le 4 déc. 2018 à 1:01,Déborah Loye
567,La Bourse de Paris débute décembre en nette hausse,Publié le 4 déc. 2018 à 1:01,Guillaume Benoit
568,RACHETER ET S'ALLIER POUR S'IMPOSER SUR UN MARCHE,Publié le 4 déc. 2018 à 1:01,Célia Pénavaire
569,Comment apprendre à pitcher devant des Américains,Publié le 4 déc. 2018 à 1:01,Laetitia Lienhard
570,Pétrole : pourquoi l'Opep compte toujours,Mis à jour le 6 août 2019 à 0:00,Vincent Collen
571,Pouvoir d'achat : le grand malentendu,Mis à jour le 6 août 2019 à 0:00,Étienne Lefebvre
572,Vent de face,Mis à jour le 6 août 2019 à 0:00,David Barroux
573,Abandon des péages urbains : l'Ile-de-France rit jaune,Mis à jour le 6 août 2019 à 0:00,
574,Une sécu pour les vieillards ?,Mis à jour le 6 août 2019 à 0:00,Julien Damon
575,Sortir la mobilité de l'impasse écologique,Mis à jour le 6 août 2019 à 0:00,Thierry Mallet
576,Pour une révolution pédagogique à l'université,Mis à jour le 6 août 2019 à 0:00,Benedicte Durand
577,"« La Traviata », version originale",Mis à jour le 6 août 2019 à 0:00,Philippe Venturini
578,« Dernière journée sur Terre » : familles en pièces,Mis à jour le 6 août 2019 à 0:00,Philippe Chevilley
579,De nouveaux outils pour repousser les limites de l'intelligence artificielle,Mis à jour le 6 août 2019 à 0:00,Remy Demichelis
580,Brexit : les cinq adversaires de Theresa May,Mis à jour le 6 août 2019 à 0:00,Alexandre Counis
581,Les groupes américains face au défi des restructurations,Mis à jour le 6 août 2019 à 0:00,Nicolas Rauline
582,Agriconomie s'impose comme la plate-forme d'achats en ligne,Mis à jour le 6 août 2019 à 0:00,Guillaume Roussange
583,Epsor finance sa plate-forme d'épargne salariale dédiée aux PME,Mis à jour le 6 août 2019 à 0:00,Emmanuel Guimard
584,"La mort d'Albert Frère, grande figure du capitalisme européen",Mis à jour le 6 août 2019 à 0:00,Sylvie Ramadier
585,"Samuel Barnabas, au volant de Norauto France",Mis à jour le 6 août 2019 à 0:00,Nicole Buyse
586,Tamim ben Hamad Al Thani,Mis à jour le 6 août 2019 à 0:00,Sabine Delanglade
587,Les « gilets jaunes » peinent à trouver des représentants,Publié le 3 déc. 2018 à 1:01,Grégoire Poussielgue
588,Cancer : un nouvel anticorps plus efficace ?,Publié le 3 déc. 2018 à 1:01,Yann Verdo
589,Etats-Unis : deuil national pour George H. W. Bush,Publié le 3 déc. 2018 à 1:01,Elsa Freyssenet
590,Les aides existantes pour l'habitat ancien,Publié le 3 déc. 2018 à 1:01,Catherine Sabbah
591,Les Français plus attentifs aux engagements des marques,Publié le 3 déc. 2018 à 1:01,Valérie Leboucq
592,"Flaminem, l'autre option des services secrets",Publié le 3 déc. 2018 à 1:01,Florian Dèbes
593,5 start-up à suivre,Publié le 3 déc. 2018 à 1:01,
594,Fabrice Brégier : « Nous voulons développer un écosystème de start-up françaises autour de Palantir »,Publié le 3 déc. 2018 à 1:01,Anne Drif
595,Grève chez Natixis,Publié le 3 déc. 2018 à 1:01,Thibaut Madelin
596,La Bourse de Paris conserve de justesse les 5.000 points,Publié le 3 déc. 2018 à 1:01,Muryel Jacque
597,"L'ETI, modèle de management",Publié le 3 déc. 2018 à 1:01,
598,Cinq leviers pour devenir une ETI,Publié le 3 déc. 2018 à 1:01,Vincent Bouquet
599,"Frédéric Coirier « Pour ces sociétés, il n'y a pas de succès sans vision de long terme »",Publié le 3 déc. 2018 à 1:01,Vincent Bouquet
600,Les 5 idées à retenir de... « L'entreprise inspirante »,Publié le 3 déc. 2018 à 1:01,
601,Une entreprise qui contribue au bien commun,Publié le 3 déc. 2018 à 1:01,
602,Comment Maisons du Monde structure son pilotage « durable »,Publié le 3 déc. 2018 à 1:01,Valerie Landrieu
603,LUXEMBOURG Les promesses de la finance contre le réchauffement,Publié le 3 déc. 2018 à 1:01,
604,RECYCLAGE Morphosis explore les veines du gisement des déchets électroniques,Publié le 3 déc. 2018 à 1:01,Joël Cossardeaux
605,ESPAGNE L'électrique pour favoriser l'écomobilité,Publié le 3 déc. 2018 à 1:01,
606,ELEVAGE Des vaches qui produisent plus de lait et moins de gaz,Publié le 3 déc. 2018 à 1:01,
607,INDE Des forêts urbaines pour combattre la pollution en Inde,Publié le 3 déc. 2018 à 1:01,
608,"Renault-Nissan, le grand malentendu",Mis à jour le 6 août 2019 à 0:00,Anne Feitz
609,Condamner la violence sans ambiguïté,Mis à jour le 6 août 2019 à 0:00,Jean-Francis Pécresse
610,La Chinamerica et le reste du monde,Mis à jour le 6 août 2019 à 0:00,Jacques Hubert-Rodier
611,"En 2019, les choses vont se compliquer pour la Fed",Mis à jour le 6 août 2019 à 0:00,
612,Cinq clefs pour comprendre les Etats-Unis,Mis à jour le 6 août 2019 à 0:00,Laura Berny
613,Imposons la mixité dans l'économie numérique,Mis à jour le 6 août 2019 à 0:00,
614,Raison d'être : et si l'Etat se posait la question lui aussi ?,Mis à jour le 6 août 2019 à 0:00,Jean De Belot
615,« Cendrillon » sous les sunlights,Mis à jour le 6 août 2019 à 0:00,Philippe Noisette
616,Chanter la vie,Mis à jour le 6 août 2019 à 0:00,Philippe Chevilley
617,Woleet lève 1 million d'euros pour déployer son empreinte numérique,Mis à jour le 6 août 2019 à 0:00,Stanislas du Guerny
618,UniVR Studio utilise la réalité virtuelle pour des formations critiques,Mis à jour le 6 août 2019 à 0:00,Lea Delpont
619,"Annie Feolde, star de la cuisine italienne",Mis à jour le 6 août 2019 à 0:00,Olivier Tosseri
620,Un monde trop inconnu,Mis à jour le 6 août 2019 à 0:00,Muriel Jasor
621,Ségolène Royal,Mis à jour le 6 août 2019 à 0:00,Sabine Delanglade
622,COP24 Les entreprises sur le pont,Mis à jour le 6 août 2019 à 0:00,Joël Cossardeaux
623,Paul Polman : « C'est à nous de relever le défi du changement climatique »,Mis à jour le 6 août 2019 à 0:00,
