,titre,jour_publication,auteur
268,Les comédies musicales en habits de lumière,Mis à jour le 6 août 2019 à 0:00,
269,Tout sur la maison de Molière,Mis à jour le 6 août 2019 à 0:00,Philippe Chevilley
270,Salles obscures,Publié le 14 déc. 2018 à 1:01,Thierry Gandillot
271,"Richelieu, si loin, si près",Mis à jour le 6 août 2019 à 0:00,Henri Gibier
272,"Édimbourg, une promenade dans la cité des lettres",Publié le 14 déc. 2018 à 1:01,Adrien Gombeaud
273,EDIMBOURG - Dans l'enfer des erreurs financières,Publié le 14 déc. 2018 à 1:01,Adrien Gombeaud
274,Le syndrome de l'hôtel particulier,Publié le 14 déc. 2018 à 1:01,Gilles Denis
275,Nouvelle ère,Publié le 14 déc. 2018 à 1:01,Astrid Faguer
276,Le pull de Noël,Publié le 14 déc. 2018 à 1:01,Guillaume Salmon
277,Le monde au poignet,Publié le 14 déc. 2018 à 1:01,Frank DECLERCK
278,"Manko, le goût vif du Pérou",Mis à jour le 6 août 2019 à 0:00,Laurent Guez
279,La rédaction des «Échos» a testé,Mis à jour le 6 août 2019 à 0:00,
280,Top 5 Les meilleures tartes au chocolat,Publié le 14 déc. 2018 à 1:01,Jerome Berger
281,Le grain de sel de Manoj Sharma,Publié le 14 déc. 2018 à 1:01,Jerome Berger
282,", saluez!",Publié le 14 déc. 2018 à 1:01,Jean-Francis Pécresse
283,Où boire un cocktail à Rome?,Publié le 14 déc. 2018 à 1:01,Sylvain Ouchikh
284,Tech et chic,Publié le 14 déc. 2018 à 1:01,Cédric Fréour
285,Cinq pistes pour skier malin,Publié le 14 déc. 2018 à 1:01,Eric DELON
286,Délices d'initiés,Publié le 14 déc. 2018 à 1:01,Jean-Denis Errard
287,"L'exercice physique, rien que du bonheur",Publié le 14 déc. 2018 à 1:01,Claude Vincent
288,Nature: Ducasse se décarcasse,Publié le 14 déc. 2018 à 1:01,Claude Vincent
289,Vitamine D: trop méconnue,Publié le 14 déc. 2018 à 1:01,Claude Vincent
290,Docteur No,Publié le 14 déc. 2018 à 1:01,Claude Vincent
291,Mauvais clou,Publié le 14 déc. 2018 à 1:01,Marc Dugain
292,"Les cadres, grands perdants de la justice négociée",Mis à jour le 6 août 2019 à 0:00,Valérie de Senneville
293,"Le climat attendra, encore",Mis à jour le 6 août 2019 à 0:00,Laura Berny
294,Un équilibriste à la BCE,Mis à jour le 6 août 2019 à 0:00,Guillaume Maujean
295,Du bon usage de la fiscalité,Mis à jour le 6 août 2019 à 0:00,
296,La mer sous différentes facettes,Mis à jour le 6 août 2019 à 0:00,Marianne BLIMAN
297,Notre « Media culpa »,Mis à jour le 6 août 2019 à 0:00,Laurent Guimier
298,Cybermanipulations saison 2,Mis à jour le 6 août 2019 à 0:00,Matthieu Courtecuisse
299,Plongée dans les conflits du cyberespace,Mis à jour le 6 août 2019 à 0:00,Yves Bourdillon
300,Manuel de survie pour l'IA en entreprise,Mis à jour le 6 août 2019 à 0:00,Remy Demichelis
301,Ces douze hommes qui ont décroché la Lune,Mis à jour le 6 août 2019 à 0:00,Yann Verdo
302,Le ruissellement imaginaire,Mis à jour le 6 août 2019 à 0:00,Remy Demichelis
303,"Romain Bocognani, « Francese » parmi les constructeurs romains",Mis à jour le 6 août 2019 à 0:00,Olivier Tosseri
304,Bruce Springsteen,Mis à jour le 6 août 2019 à 0:00,Henri Gibier
305,vin : le temps de la relève,Mis à jour le 6 août 2019 à 0:00,Jean-Francis Pécresse
306,"Anne Le Naour, la « cheffe d'orchestre »",Mis à jour le 6 août 2019 à 0:00,Frank Niedercorn
307,"Jacky Lorenzetti, passeur de passion",Mis à jour le 6 août 2019 à 0:00,
308,"« Cathiard & cie », la firme du bonheur",Mis à jour le 6 août 2019 à 0:00,
309,Le sang des Ostertag,Mis à jour le 6 août 2019 à 0:00,
310,Deux générations d'Angélus main dans la main,Mis à jour le 6 août 2019 à 0:00,
311,Gérard le Généreux,Mis à jour le 6 août 2019 à 0:00,
312,"Bernard Magrez, l'homme debout",Mis à jour le 6 août 2019 à 0:00,
313,Conseillers viticoles : les trois figures de la nouvelle génération,Mis à jour le 6 août 2019 à 0:00,
314,Pourquoi les archives du djihadisme doivent rester accessibles,Publié le 13 déc. 2018 à 1:01,Benoît Georges
315,Un guide pour faire grandir les PME,Publié le 13 déc. 2018 à 1:01,Remy Demichelis
316,Les deux Corées démantèlent leurs postes-frontières,Publié le 13 déc. 2018 à 1:01,Michel De Grandi
317,Finalcad remonte son ambition d'un cran,Publié le 13 déc. 2018 à 1:01,Guillaume Bregeras
318,Glose ambitionne de ramener les élèves à la lecture,Publié le 13 déc. 2018 à 1:01,Guillaume Bregeras
319,New Faces veut faire décoller les talents créatifs des banlieues,Publié le 13 déc. 2018 à 1:01,Déborah Loye
320,La Bourse de Paris poursuit son rebond,Publié le 13 déc. 2018 à 1:01,
321,"START-UP, TROIS CONCOURS AUXQUELS CANDIDATER",Publié le 13 déc. 2018 à 1:01,
322,L'Afnic encourage les TPE-PME à combler leur retard numérique,Publié le 13 déc. 2018 à 1:01,Yves Vilaginés
323,"La Première ministre, la ténacité incarnée",Mis à jour le 6 août 2019 à 0:00,Alexandre Counis
324,La crédibilité de Macron entamée auprès de ses partenaires,Mis à jour le 6 août 2019 à 0:00,Catherine Chatignoux
325,Bienvenue dans le capitalisme 4.0,Mis à jour le 6 août 2019 à 0:00,Guillaume Maujean
326,"Usine à gaz, le retour",Mis à jour le 6 août 2019 à 0:00,Étienne Lefebvre
327,Cette crise du pouvoir d'achat qui couvait depuis dix ans,Mis à jour le 6 août 2019 à 0:00,Guillaume de Calignon
328,Le projet des Républicains n'est pas socialiste,Mis à jour le 6 août 2019 à 0:00,
329,Plongée photographique dans les voyages d'antan,Mis à jour le 6 août 2019 à 0:00,Marianne BLIMAN
330,"Oui, la zone euro est capable de se réformer",Mis à jour le 6 août 2019 à 0:00,Mario Centeno
331,Comment la crise amplifie le populisme,Mis à jour le 6 août 2019 à 0:00,Hélène Rey
332,"Berry, le plaideur",Mis à jour le 6 août 2019 à 0:00,Valérie de Senneville
333,"Joffrin, imbattable sur l'Armada",Mis à jour le 6 août 2019 à 0:00,Thierry Gandillot
334,Le modèle inédit de Maison Kitsuné,Mis à jour le 6 août 2019 à 0:00,Dominique Chapuis
335,Jean-Paul Delevoye. L'évangéliste de la retraite universelle,Mis à jour le 6 août 2019 à 0:00,Solveig Godeluck
336,"La France, le pays qui résiste aux activistes",Mis à jour le 6 août 2019 à 0:00,Isabelle Couet
337,"Apex Energies lève 13,5 millions pour son parc photovoltaïque",Mis à jour le 6 août 2019 à 0:00,Hubert Vialatte
338,AgriLab modélise la germination des pommes de terre,Mis à jour le 6 août 2019 à 0:00,Guillaume Roussange
339,La fin d'un programme qui a bouleversé les marchés financiers européens,Mis à jour le 6 août 2019 à 0:00,Guillaume Benoit
340,"Louis Guyot, directeur financier de l'année",Mis à jour le 6 août 2019 à 0:00,Vincent Bouquet
341,Un « Guide de Davos » pour Jair Bolsonaro,Publié le 12 déc. 2018 à 1:01,Thierry Ogier
342,Willa s'engage pour la place des femmes dans la deeptech,Publié le 12 déc. 2018 à 1:01,Déborah Loye
343,Inspiring Fifty : 50 femmes pour donner l'exemple,Publié le 12 déc. 2018 à 1:01,Guillaume Bregeras
344,Maurice Lévy lance Ycor avec 30 millions d'euros,Publié le 12 déc. 2018 à 1:01,Guillaume Bregeras
345,La Bourse de Paris s'offre un rebond à plus de 4.800 points,Publié le 12 déc. 2018 à 1:01,Pierrick Fay
346,"Montants élevés, immatériel : le leasing gagne du terrain",Publié le 12 déc. 2018 à 1:01,
347,"Chez Aviva, le flex office pour « briser les silos »",Publié le 12 déc. 2018 à 1:01,Alexia Eychenne
348,FRÉDÉRIC MARTIN Directeur marché santé à Factum Group,Publié le 12 déc. 2018 à 1:01,
349,Le Fonds parisien d'art contemporain sort de sa réserve,Publié le 12 déc. 2018 à 1:01,Martine Robert
350,Théâtre des Amandiers : Nanterre a choisi son projet,Publié le 12 déc. 2018 à 1:01,Laurence Albert
351,Le squelette de la tour Pleyel en attente de rénovation,Publié le 12 déc. 2018 à 1:01,Marion Kindermans
352,ZAC Marne-Europe : la pollution des terres plus importante que prévu,Publié le 12 déc. 2018 à 1:01,Marion Kindermans
353,Maisons-Laffitte déplore la fermeture de son hippodrome,Publié le 12 déc. 2018 à 1:01,
354,Le Download festival reviendra sur la base aérienne 217 en 2020,Publié le 12 déc. 2018 à 1:01,Caroline d'Avout
355,Montigny-lès-Cormeilles va métamorphoser la Patte-d'Oie,Publié le 12 déc. 2018 à 1:01,Florence Renard-Gourdon
356,Le centre commercial de la Porte des Alpes doit se réinventer,Publié le 12 déc. 2018 à 1:01,Vincent Charbonnier
357,L'orchestre national de Lyon change de visage,Publié le 12 déc. 2018 à 1:01,Lamia Barbot
358,"A Villeurbanne, le Terrain des Soeurs se transforme",Publié le 12 déc. 2018 à 1:01,Lea Delpont
359,Une nouvelle défaite pour Philippe Martinez,Mis à jour le 6 août 2019 à 0:00,Leïla de Comarmond
360,"Le Mouvement 5 étoiles, précurseur des « gilets jaunes »",Mis à jour le 6 août 2019 à 0:00,Pierre de Gasquet
361,Savoir arrêter,Mis à jour le 6 août 2019 à 0:00,Nicolas Barré
362,Bascule syndicale,Mis à jour le 6 août 2019 à 0:00,Étienne Lefebvre
363,Des entreprises plus fortes que les Etats,Mis à jour le 6 août 2019 à 0:00,
364,A la recherche du vin perdu,Mis à jour le 6 août 2019 à 0:00,Frank Niedercorn
365,Les « gilets jaunes » ou comment remédier au vide organisationnel,Mis à jour le 6 août 2019 à 0:00,Heloise Berkowitz
366,Bien comprendre la France pour mieux la réformer,Mis à jour le 6 août 2019 à 0:00,Michel Sauzay
367,Dans les secrets d'« Une affaire de famille »,Mis à jour le 6 août 2019 à 0:00,Thierry Gandillot
368,Tu n'as rien vu à Utoya,Mis à jour le 6 août 2019 à 0:00,Adrien Gombeaud
369,Nous les coyotes,Mis à jour le 6 août 2019 à 0:00,Olivier De Bruyn
370,L'ascension et la chute du docteur Faust de Wall Street,Mis à jour le 6 août 2019 à 0:00,Nessim Aït-Kacimi
371,"François Houllier, de la terre à la mer",Mis à jour le 6 août 2019 à 0:00,Stanislas du Guerny
372,Hirokazu Kore-eda,Mis à jour le 6 août 2019 à 0:00,Sabine Delanglade
373,"Entreprises, start-up, écoles : le défi de la diversité",Publié le 11 déc. 2018 à 1:01,
374,Les syndicats prennent acte du changement de méthode,Publié le 11 déc. 2018 à 1:01,Leïla de Comarmond
375,"A Oslo, la remise des prix Nobel de la paix",Publié le 11 déc. 2018 à 1:01,Michel De Grandi
376,La machine à noter les start-up Early Metrics change de braquet,Publié le 11 déc. 2018 à 1:01,Guillaume Bregeras
377,Hardware Club accélère avec un fonds à 50 millions de dollars,Publié le 11 déc. 2018 à 1:01,Déborah Loye
378,Trois investissements internationaux à suivre du Hardware Club,Publié le 11 déc. 2018 à 1:01,Déborah Loye
379,Le « bear market » s'étend dans le monde,Publié le 11 déc. 2018 à 1:01,Pierrick Fay
380,La Bourse de Paris minée par le Brexit,Publié le 11 déc. 2018 à 1:01,Sophie Rolland
381,Société Générale ouvre à Paris une offre de compensation,Publié le 11 déc. 2018 à 1:01,Guillaume Benoit
382,Une paix amère,Mis à jour le 6 août 2019 à 0:00,Jean-Francis Pécresse
383,Qu'est-ce qui pourrait sauver la Bourse ?,Mis à jour le 6 août 2019 à 0:00,Guillaume Maujean
384,La bataille Pékin-Washington va bien au-delà du commerce,Mis à jour le 6 août 2019 à 0:00,Michel De Grandi
385,Réinventer notre Etat providence,Mis à jour le 6 août 2019 à 0:00,
386,Le kaléidoscope de la France,Mis à jour le 6 août 2019 à 0:00,Clotilde Briard
387,"Réveiller l'Europe, c'est maintenant !",Mis à jour le 6 août 2019 à 0:00,Olivier Klein
388,Décarboner l'économie n'a rien d'une utopie,Mis à jour le 6 août 2019 à 0:00,Hans Joachim Schellnhuber
389,"Belles BD, beau Noël",Mis à jour le 6 août 2019 à 0:00,David Barroux
390,L'édition du génome doit-elle tout miser sur CRISPR ?,Mis à jour le 6 août 2019 à 0:00,Catherine Ducruet
391,Le casse-tête des coopérations industrielles,Mis à jour le 6 août 2019 à 0:00,Anne Bauer
392,GenOway décroche une licence mondiale de Merck KGaA,Mis à jour le 6 août 2019 à 0:00,Lea Delpont
393,ADP finance Innov'ATM qui optimise le trafic des avions et drones,Mis à jour le 6 août 2019 à 0:00,Laurent Marcaillou
394,"Christian de Portzamparc, sculpteur de villes",Mis à jour le 6 août 2019 à 0:00,Catherine Sabbah
395,Laurent Berger,Mis à jour le 6 août 2019 à 0:00,Sabine Delanglade
396,La recherche en France va mal !,Publié le 10 déc. 2018 à 1:01,
397,"Speculoos, le nouveau traqueur d'exoplanètes européen",Publié le 10 déc. 2018 à 1:01,Yann Verdo
398,Nouvelle chute des dons recueillis par le Téléthon,Publié le 10 déc. 2018 à 1:01,Matthieu Quiret
399,"Au salon Slush de Helsinki, les start-up invitées à faire plus de place aux femmes",Publié le 10 déc. 2018 à 1:01,Déborah Loye
400,Deux stars nordiques de la « Tech for Good »,Publié le 10 déc. 2018 à 1:01,Déborah Loye
401,Les benjamins de la délégation française ont su tirer parti de Slush,Publié le 10 déc. 2018 à 1:01,Déborah Loye
402,"Le numéro un européen du tissu élastique, Cheynet & Fils cherche repreneur",Publié le 10 déc. 2018 à 1:01,Denis Meynard
403,La Bourse de Paris se redresse timidement vendredi,Publié le 10 déc. 2018 à 1:01,Hélène Dupuy
404,L'ADN du leadership est en train de changer,Publié le 10 déc. 2018 à 1:01,
405,Une étoffe de futurs grands leaders,Publié le 10 déc. 2018 à 1:01,Muriel Jasor
406,"Laura Georges, l'enthousiasme d'abord",Publié le 10 déc. 2018 à 1:01,
407,Charlotte Gautier « Les jeux de pouvoir font perdre un temps précieux »,Publié le 10 déc. 2018 à 1:01,Vincent Bouquet
408,La dauphine d'Angela Merkel fait un premier geste vers son aile droite,Mis à jour le 6 août 2019 à 0:00,Ninon Renaud
409,Comment ouvrir (vraiment) les conseils d'administration,Mis à jour le 6 août 2019 à 0:00,Jean-Marc Vittori
410,Responsabilité collective,Mis à jour le 6 août 2019 à 0:00,Étienne Lefebvre
411,Les vrais maîtres de l'or noir,Mis à jour le 6 août 2019 à 0:00,Guillaume Maujean
412,Des « gilets jaunes » si français,Mis à jour le 6 août 2019 à 0:00,
413,"Les Noailles, mécènes absolus",Mis à jour le 6 août 2019 à 0:00,Martine Robert
414,Reconstruire le pacte démocratique,Mis à jour le 6 août 2019 à 0:00,tribune collective
415,« Gilets jaunes » et prix des transports,Mis à jour le 6 août 2019 à 0:00,Emile Quinet
416,François Morel dans l'esprit de Devos,Mis à jour le 6 août 2019 à 0:00,Vincent Bouquet
417,"Lia Rodrigues, de bruit et de « Fúria »",Mis à jour le 6 août 2019 à 0:00,Philippe Noisette
418,PrediLife espère lever 8 millions pour ses tests prédictifs du cancer,Mis à jour le 6 août 2019 à 0:00,Chantal Houzelle
419,New Health Community va tester son robot d'assistance médicale,Mis à jour le 6 août 2019 à 0:00,Laurent Marcaillou
420,"Alexandre Falck, file au But",Mis à jour le 6 août 2019 à 0:00,Philippe Bertrand
421,"Mélanie Jourdain, l'exigence de la performance",Mis à jour le 6 août 2019 à 0:00,Valerie Landrieu
422,"Maud Bailly, le défi comme boussole",Mis à jour le 6 août 2019 à 0:00,
423,"Elsa Darquier, la sincérité avant tout",Mis à jour le 6 août 2019 à 0:00,Delphine Iweins
424,Riccardo Falconi ou l'appétence au risque,Mis à jour le 6 août 2019 à 0:00,Delphine Iweins
425,"Astrid Fockens, la passion du digital",Mis à jour le 6 août 2019 à 0:00,Valerie Landrieu
426,Carlos Ghosn,Mis à jour le 6 août 2019 à 0:00,Lucie Robequain
427,Martin Fourcade commence sa saison à fond !,Publié le 7 déc. 2018 à 1:01,
428,"La France, future « scale-up nation »",Publié le 7 déc. 2018 à 1:01,Guillaume Bregeras
429,Forte correction à la Bourse de Paris,Publié le 7 déc. 2018 à 1:01,
430,L'Italie réussit son opération d'échange de dette,Publié le 7 déc. 2018 à 1:01,Guillaume Benoit
431,Comment optimiser le levier du crédit,Publié le 7 déc. 2018 à 1:01,
432,"SCPI, crédit, démembrement : tiercé gagnant",Publié le 7 déc. 2018 à 1:01,
433,Emprunter pour mieux transmettre son patrimoine immobilier,Publié le 7 déc. 2018 à 1:01,
434,Devenir business angel,Publié le 7 déc. 2018 à 1:01,
435,Le choix du réseau,Publié le 7 déc. 2018 à 1:01,
436,Forger une assurance-vie à sa mesure,Publié le 7 déc. 2018 à 1:01,Laurence Delain
437,Trois pistes pour doper son revenu,Publié le 7 déc. 2018 à 1:01,Laurence Delain
438,"Les vignes, un placement exigeant à fort potentiel",Publié le 7 déc. 2018 à 1:01,Laurence Boccara
439,Le refuge de la forêt,Publié le 7 déc. 2018 à 1:01,Laurence Boccara
440,Les précautions à prendre pour se lancer sur le marché de l'art,Publié le 7 déc. 2018 à 1:01,Laurence Boccara
441,Les atouts et les pièges du club deal immobilier,Publié le 7 déc. 2018 à 1:01,
442,Quels avantages fiscaux ?,Publié le 7 déc. 2018 à 1:01,Laurence Boccara
443,Ces trois start-up recherchent des associés,Publié le 7 déc. 2018 à 1:01,
444,Comment évaluer le capital immatériel de son entreprise,Publié le 7 déc. 2018 à 1:01,
445,Habillage,Publié le 7 déc. 2018 à 1:01,Henri Gibier
446,L'agenda en France,Publié le 7 déc. 2018 à 1:01,
447,Salle d'attente,Publié le 7 déc. 2018 à 1:01,Philippe Besson
448,L'agenda à Paris,Publié le 7 déc. 2018 à 1:01,Alice d'Orgeval
449,L'agenda ailleurs,Publié le 7 déc. 2018 à 1:01,Alice d'Orgeval
450,La playlist de l'actu,Publié le 7 déc. 2018 à 1:01,
451,Rolando Villazón,Mis à jour le 6 août 2019 à 0:00,Florence Bauchard
452,NORVEGE - Le faux ami de la planète,Publié le 7 déc. 2018 à 1:01,Lucie Robequain
453,Mas Subramanian - Le génial chasseur de couleurs de l'Oregon,Mis à jour le 6 août 2019 à 0:00,Anaïs Moutot
454,6 chefs-d'oeuvre qu'on se dispute,Publié le 7 déc. 2018 à 1:01,Karl De Meyer
455,God save the privatisations,Mis à jour le 6 août 2019 à 0:00,Alexandre Counis
456,Ego-trips,Publié le 7 déc. 2018 à 1:01,Gilles Denis
457,Une rétrospective Bruegel unique à Vienne,Mis à jour le 6 août 2019 à 0:00,Judith Benhamou
458,"Trottola, cirque d'émotions",Mis à jour le 6 août 2019 à 0:00,Marianne BLIMAN
459,Un grand frisson nommé Janis,Mis à jour le 6 août 2019 à 0:00,Christian Eudeline
460,Salles obscures,Publié le 7 déc. 2018 à 1:01,Thierry Gandillot
461,"Jakub Josef Orlinski, voix sacrée",Mis à jour le 6 août 2019 à 0:00,Gilles Denis
462,"Saint-Ex, De Gaulle et Françoise",Mis à jour le 6 août 2019 à 0:00,Pierre de Gasquet
463,Secrets de confréries,Publié le 7 déc. 2018 à 1:01,Anne-Charlotte De Langhe
464,Bulles de culture,Publié le 7 déc. 2018 à 1:01,Olivier De Bruyn
465,Vins de fêtes,Publié le 7 déc. 2018 à 1:01,Sylvain Ouchikh
466,L'esprit du temps,Publié le 7 déc. 2018 à 1:01,Gilles Denis
467,Cool check,Publié le 7 déc. 2018 à 1:01,Astrid Faguer
468,Curating : mot actuellement très tendance dans l'univers de la mode,Publié le 7 déc. 2018 à 1:01,Olivier Gabet
469,En mode connecté,Publié le 7 déc. 2018 à 1:01,Frank DECLERCK
470,Qui est parti sans son stick ?,Publié le 7 déc. 2018 à 1:01,Johanne Courbatère de Gaudric
471,La théorie de l'évolution,Publié le 7 déc. 2018 à 1:01,
472,La HD au-delà du réel,Publié le 7 déc. 2018 à 1:01,Raphaël Sachetat
473,"Mr. T, de bruit et de saveurs",Mis à jour le 6 août 2019 à 0:00,Laurent Guez
474,La rédaction des «Échos» a testé,Mis à jour le 6 août 2019 à 0:00,
475,À bout de soufre,Publié le 7 déc. 2018 à 1:01,Jean-Francis Pécresse
476,Le grain de sel d'Éric Pras,Publié le 7 déc. 2018 à 1:01,Jerome Berger
477,"Le repaire À Londres, un monument sur Russell Square",Publié le 7 déc. 2018 à 1:01,Gilles Denis
478,Plaisir égoïste,Publié le 7 déc. 2018 à 1:01,Marc Schlicklin
479,Serial loueurs,Publié le 7 déc. 2018 à 1:01,Eugenie Deloire
480,Délices d'initiés,Publié le 7 déc. 2018 à 1:01,Jean-Denis Errard
481,Ski: aie conscience...,Publié le 7 déc. 2018 à 1:01,Claude Vincent
482,"Superfood: ça, c'est palace",Publié le 7 déc. 2018 à 1:01,Claude Vincent
483,Attentats: les proches aussi,Publié le 7 déc. 2018 à 1:01,Claude Vincent
484,Objets perdus 3.0,Publié le 7 déc. 2018 à 1:01,Claude Vincent
485,L'autre révolution numérique,Publié le 7 déc. 2018 à 1:01,Marc Dugain
486,"Friedrich Merz, candidat de la rupture",Mis à jour le 6 août 2019 à 0:00,
487,"Annegret Kramp-Karrenbauer, l'héritière",Mis à jour le 6 août 2019 à 0:00,
488,"Jens Spahn, le challenger junior",Mis à jour le 6 août 2019 à 0:00,
489,Merkel en liberté conditionnelle,Mis à jour le 6 août 2019 à 0:00,Ninon Renaud
490,Ne pas s'avouer vaincu,Mis à jour le 6 août 2019 à 0:00,David Barroux
491,La lourde facture des « gilets jaunes »,Mis à jour le 6 août 2019 à 0:00,Étienne Lefebvre
492,Régulation des cryptomonnaies : comment la France s'organise,Mis à jour le 6 août 2019 à 0:00,Laurence Boisseau
493,"Les transports autonomes, une réponse à la crise des territoires",Mis à jour le 6 août 2019 à 0:00,
494,Troubles dans la vérité,Mis à jour le 6 août 2019 à 0:00,Julien Damon
495,Travailleur des plates-formes : inventer un nouveau modèle,Mis à jour le 6 août 2019 à 0:00,Yann-Mael Larher
496,Il faut faire évoluer la gouvernance des coopératives françaises,Mis à jour le 6 août 2019 à 0:00,Bertrand Magnien
497,Comment les centres commerciaux ont vidé les centres-villes,Mis à jour le 6 août 2019 à 0:00,Kévin Badeau
498,Les dix vérités économiques qu'il nous faut entendre,Mis à jour le 6 août 2019 à 0:00,Daniel Fortin
499,Nouveaux pauvres et nouveaux riches,Mis à jour le 6 août 2019 à 0:00,Daniel Fortin
500,L'introuvable dialogue social,Mis à jour le 6 août 2019 à 0:00,Daniel Fortin
501,Le discounter DIA est au bord du gouffre,Mis à jour le 6 août 2019 à 0:00,Cécile Thibaud
502,"En cinq ans, les licornes sont devenues un troupeau à 1.000 milliards de dollars",Mis à jour le 6 août 2019 à 0:00,Nicolas Richaud
503,Comment l'expression s'est popularisée dans le monde des start-up,Mis à jour le 6 août 2019 à 0:00,Nicolas Richaud
504,Thierry Loy mène les Milanais à la baguette,Mis à jour le 6 août 2019 à 0:00,Olivier Tosseri
505,Friedrich Merz,Mis à jour le 6 août 2019 à 0:00,Henri Gibier
506,Le goût du luxe,Mis à jour le 6 août 2019 à 0:00,Marie-Christine Sonkin
507,Du don à la philanthropie : le mode d'emploi pour des actions efficaces,Publié le 7 déc. 2018 à 0:39,Laurence Boccara
508,La Reine Elizabeth au centre caritatif Coram,Publié le 6 déc. 2018 à 1:01,Catherine Chatignoux
509,Bpifrance veut acculturer les fonds français à la Silicon Valley,Publié le 6 déc. 2018 à 1:01,Anaïs Moutot
510,L'accélérateur de start-up Ekito en liquidation,Publié le 6 déc. 2018 à 1:01,Laurent Marcaillou
511,L'assurtech Element veut se déployer hors d'Allemagne,Publié le 6 déc. 2018 à 1:01,Laurent Thévenin
512,La France renforce son contrôle des acquisitions étrangères,Publié le 6 déc. 2018 à 1:01,Anne Drif
513,La Bourse de Paris plonge sous les 5.000 points,Publié le 6 déc. 2018 à 1:01,Laurence Boisseau
514,Sophie Cluzel Secrétaire d'Etat chargée des Personnes handicapées,Publié le 6 déc. 2018 à 1:01,Olivier Harmant
515,« ADOPTER UNE STRUCTURE SOUPLE POUR SE LANCER »,Publié le 6 déc. 2018 à 1:01,Célia Pénavaire
516,5 pièges à éviter lors d'une négociation commerciale,Publié le 6 déc. 2018 à 1:01,Ariane Gaudefroy
517,Les défis du modèle bancaire français,Mis à jour le 6 août 2019 à 0:00,Thibaut Madelin
518,Le mauvais débat sur l'ISF,Mis à jour le 6 août 2019 à 0:00,Jean-Francis Pécresse
519,Les marchés à un tournant,Mis à jour le 6 août 2019 à 0:00,Guillaume Maujean
520,Les promesses de l'IA pour les pays en développement,Mis à jour le 6 août 2019 à 0:00,Remy Demichelis
521,Robert Badinter dans l'intimité de son enfance,Mis à jour le 6 août 2019 à 0:00,Marianne BLIMAN
522,L'addiction aux niches fiscales explique aussi la crise du logement,Mis à jour le 6 août 2019 à 0:00,Hervé Legros
523,Pour mettre fin à la jacquerie fiscale,Mis à jour le 6 août 2019 à 0:00,Frederic Cherbonnier
524,Cérémonie new age au Festival d'automne,Mis à jour le 6 août 2019 à 0:00,Philippe Venturini
525,L'Ouest au féminin,Mis à jour le 6 août 2019 à 0:00,Philippe Chevilley
526,Le nouveau siècle des lumières,Mis à jour le 6 août 2019 à 0:00,Laurent Flallo
527,"Ilya Polyakov, banquier de Paris à Moscou",Mis à jour le 6 août 2019 à 0:00,Benjamin Quenelle
528,Didier Guillaume,Mis à jour le 6 août 2019 à 0:00,Sabine Delanglade
529,Les voitures diesel très polluantes rouleront six mois de plus,Publié le 5 déc. 2018 à 1:01,Julien Dupont-Calbo
530,Derniers hommages à George H. W. Bush,Publié le 5 déc. 2018 à 1:01,Virginie Robert
531,La French Tech se dote d'outils pour féminiser ses start-up,Publié le 5 déc. 2018 à 1:01,Guillaume Bregeras
532,"Entomo Farm, le pionnier de la production d'insectes, au tapis",Publié le 5 déc. 2018 à 1:01,Frank Niedercorn
533,La Bourse de Paris rattrapée par les doutes,Publié le 5 déc. 2018 à 1:01,Laurence Boisseau
534,"En Ile-de-France, les plans de prévention des risques bouclés",Publié le 5 déc. 2018 à 1:01,Laurence Albert
535,Meudon : le Hangar Y mue en musée du dirigeable,Publié le 5 déc. 2018 à 1:01,Marion Kindermans
536,Un « plan bassin » en Seine-Saint-Denis,Publié le 5 déc. 2018 à 1:01,Florence Renard-Gourdon
537,Paris veut laisser 1.200 voitures à la porte,Publié le 5 déc. 2018 à 1:01,Laurence Albert
538,Parc Princesse : la guerre des communes est déclarée,Publié le 5 déc. 2018 à 1:01,
539,Nouveaux recours contre la refonte du RER D,Publié le 5 déc. 2018 à 1:01,
540,Vauréal mise sur les résidences plurigénérationnelles,Publié le 5 déc. 2018 à 1:01,Florence Renard-Gourdon
541,Villeurbanne lance une consultation publique sur le cannabis,Publié le 5 déc. 2018 à 1:01,Lea Delpont
542,L'école des Plombiers du Numérique ouvre à Lyon,Publié le 5 déc. 2018 à 1:01,Lea Delpont
